{
  "schema_version": "1.0",
  "algorithm": "ed25519",
  "receipt": {
    "decision_id": "DEC-PRODUCT-001",
    "summary": "One bounded product decision",
    "scope": "replace-with-exact-product-scope",
    "assumptions": [{
      "path": "replace-with-repository-relative-baseline-path",
      "sha256": "replace-with-sha256-of-exact-artifact-bytes"
    }],
    "assumptions_sha256": "replace-with-sha256-of-canonical-assumptions-array",
    "reopen_condition": "scope_or_assumptions_change",
    "approved_by": "replace-with-owner-id",
    "issued_at": "REPLACE_WITH_CURRENT_TIME_RFC3339",
    "expires_at": "REPLACE_WITH_EXPIRY_TIME_RFC3339",
    "nonce": "replace-with-unique-random-nonce"
  },
  "signature": "replace-with-base64-ed25519-signature"
}
